"Zupid","sku","ProductName","ProductPrice","CurrencySymbolOfPrice","ValidFromDate","ProductShortDescription","MerchantProductCategory","ZanoxCategoryIds","ImageSmallURL","ImageMediumURL","ProductManufacturerBrand","ZanoxProductLink","DeliveryTime","TermsOfContract","ISBN","ShippingAndHandling","ShippingAndHandlingCost"
"94e254a23daf8d626b4dcca9b9ce28f5","0047375001577","Hine Cognac Rare VSOP in GP","46.99","EUR",,"Rund 25 Cognacs der Petite und Grande Champagne, die durchschnittlich ca. 10 Jahre reiften, deren Jüngster mindestens sieben Jahre in den Reifekellern ruhte, machen HINE RARE zu diesem wunderschön ausgewogenen, zugleich duftigen und vollmundigen Genuss.","Spirituosen / Dunkle Spirituosen / Cognac",,"http://shop.edeka24.de/out/pictures/generated/product/1/185_150_90/hinevsop_500_z1.jpg","http://shop.edeka24.de/out/pictures/generated/product/1/380_340_90/hinevsop_500_z1.jpg","Hine","http://www.zanox-affiliate.de/ppc/?20301248C727219293&ULP=[[pmGrwG5pLj32UWdGWBzBEd-1]]","2",,,"Ab 75 EUR Warenwert liefern wir versandkostenfrei.","3.95"
"974cc1b2e331b389512ec036e3ea7fd7","0047375001744","Ziegler Himbeerlikör 0,35 ltr","24.99","EUR",,"Die speziellen Erntegebiete in Hochlagen übertragen diesen raren Früchten den typischen, einzigartigen Ausdruck der Himbeere und vermitteln der Zunge und dem Gaumen ihre starke und hocharomatische Intensität.","Spirituosen / Klare Spirituosen / Edelbrand",,"http://shop.edeka24.de/out/pictures/generated/product/1/185_150_90/DW7CQ4QUfSsAoGfGWBzBEd-30.jpg","http://shop.edeka24.de/out/pictures/generated/product/1/380_340_90/DW7CQ4QUfSsAoGfGWBzBEd-30.jpg","Ziegler","http://www.zanox-affiliate.de/ppc/?20301248C727219293&ULP=[[8Ul1FDvITFJfvqiGWBzBEd-1]]","2",,,"Ab 75 EUR Warenwert liefern wir versandkostenfrei.","3.95"
"bb9e9c8bb95afe71f138fd119ef33b38","0047375001942","Taylors Fine Ruby Portwein","10.99","EUR",,"Portugal.","Weinkeller / Rotwein / Portugal",,"http://shop.edeka24.de/out/pictures/generated/product/1/185_150_90/taylors-fine-ruby-port.jpg","http://shop.edeka24.de/out/pictures/generated/product/1/380_340_90/taylors-fine-ruby-port.jpg","Taylors","http://www.zanox-affiliate.de/ppc/?20301248C727219293&ULP=[[snhc27602a7ed5d10ceb6cac75a67e15]]","2",,,"Ab 75 EUR Warenwert liefern wir versandkostenfrei.","3.95"
"e6f5b514abdd977f97b2ef77fdbacc43","0047375002105","Sacchetto Prosecco Colli Trevigiani Frizzante IGT","6.99","EUR",,"Der Prosecco zeigt sich in ein leuchtendes Strohgelb mit dem typisch fruchtigen Duft nach Glyzinien- und Akaziennoten. Ein unvergleichlicher Aperitif.","Champagner / Sekt / Prosecco / Sacchetto",,"http://shop.edeka24.de/out/pictures/generated/product/1/185_150_90/proseccocolli_600_z1.jpg","http://shop.edeka24.de/out/pictures/generated/product/1/380_340_90/proseccocolli_600_z1.jpg","Sacchetto","http://www.zanox-affiliate.de/ppc/?20301248C727219293&ULP=[[MiJ1DjXcFXCbrXeGWBzBEd-1]]","2",,,"Ab 75 EUR Warenwert liefern wir versandkostenfrei.","3.95"
"08439aa25703348dcb625f72fc880b48","0047375002150","Ziegler Waldhimbeergeist 0,35 ltr","33.99","EUR",,"Der Geistige. Das intensive und verführerische Waldhimbeeraroma besticht Nase und Gaumen des Kenners. Ein Schluck davon vermittelt ein Fruchterlebnis erster Güte.","Spirituosen / Klare Spirituosen / Edelbrand",,"http://shop.edeka24.de/out/pictures/generated/product/1/185_150_90/leMyiYORQRsAoGfGWBzBEd-30.jpg","http://shop.edeka24.de/out/pictures/generated/product/1/380_340_90/leMyiYORQRsAoGfGWBzBEd-30.jpg","Ziegler","http://www.zanox-affiliate.de/ppc/?20301248C727219293&ULP=[[3Wn4xtmUQFJfvqiGWBzBEd-1]]","2",,,"Ab 75 EUR Warenwert liefern wir versandkostenfrei.","3.95"
"e08e4183ec60428be7e4c3eff84f1b6d","0047375002204","Miguel Torres Brandy Gran Reserva Jaime I","69.99","EUR",,"Brandy - Spanien - Do Penedès","Dunkle Spirituosen / Brandy & Weinbrand / Miguel Torres Brandy",,"http://shop.edeka24.de/out/pictures/generated/product/1/185_150_90/miguel-torres-brrandy-gran-reserva75.jpg","http://shop.edeka24.de/out/pictures/generated/product/1/380_340_90/miguel-torres-brrandy-gran-reserva75.jpg","Miguel Torres","http://www.zanox-affiliate.de/ppc/?20301248C727219293&ULP=[[n0uzDI1pMfi8rkjGWBzBEd-1]]","2",,,"Ab 75 EUR Warenwert liefern wir versandkostenfrei.","3.95"
"62463f2b51406f00eeedeec5b5c84e45","0047375002396","Taylors Portwein Ruby Select","11.99","EUR",,"","Weinkeller / Rotwein / Portugal",,"http://shop.edeka24.de/out/pictures/generated/product/1/185_150_90/ruby_select_500_z1.jpg","http://shop.edeka24.de/out/pictures/generated/product/1/380_340_90/ruby_select_500_z1.jpg","Taylors","http://www.zanox-affiliate.de/ppc/?20301248C727219293&ULP=[[h5p4d9597c53bc9b5.86330046]]","2",,,"Ab 75 EUR Warenwert liefern wir versandkostenfrei.","3.95"
"12c2ec1bb4077be3cb7dee56e59eb131","0047375002761","Croft Original Fine Pale Cream Sherry","11.49","EUR",,"Spanien - Jerez.","Weinkeller / Portwein & Sherry",,"http://shop.edeka24.de/out/pictures/generated/product/1/185_150_90/croft-cream-sherry.jpg","http://shop.edeka24.de/out/pictures/generated/product/1/380_340_90/croft-cream-sherry.jpg","Croft","http://www.zanox-affiliate.de/ppc/?20301248C727219293&ULP=[[fv270562cc7dcbc5fbddb67c2b518d9d]]","2",,,"Ab 75 EUR Warenwert liefern wir versandkostenfrei.","3.95"
"569278c935207969c9169ca28dcde1aa","0047375002778","Gonzalez Byass Solera 1847 Oloroso Sherry Dulce","12.79","EUR",,"Spanien. Gewann die Goldmedaille des Internationalen Spirituosen-Wettbewerb 2008. Besteht aus 75% Pedro Ximenez, 25% Palomino Fino.","Weinkeller / Portwein & Sherry",,"http://shop.edeka24.de/out/pictures/generated/product/1/185_150_90/6_solera1847oloroso_500_z1.jpg","http://shop.edeka24.de/out/pictures/generated/product/1/380_340_90/6_solera1847oloroso_500_z1.jpg","Gonzalez Byass","http://www.zanox-affiliate.de/ppc/?20301248C727219293&ULP=[[inDC8L3G8w8LoGBJmn8b78-1]]","2",,,"Ab 75 EUR Warenwert liefern wir versandkostenfrei.","3.95"
"3111bab07b74d4af79f29d81c6b8e2d1","0047375002802","Lourensford Cape Red Merlot Rotwein JG 2010","4.99","EUR",,"Rotwein - Südafrika - Stollenbosch. Aus der Selection Alexander von Essen. Wer leichte und dennoch geschmacksintensive Rotweine liebt, der sollte eine Flasche dieses Merlot öffnen!","Weinkeller / Sonderaktionen / Alexander von Essen",,"http://shop.edeka24.de/out/pictures/generated/product/1/185_150_90/rot_500_z1.jpg","http://shop.edeka24.de/out/pictures/generated/product/1/380_340_90/rot_500_z1.jpg","Lourensford","http://www.zanox-affiliate.de/ppc/?20301248C727219293&ULP=[[4gVVgsEwhnyoPvBJmn8b78-1]]","2",,,"Ab 75 EUR Warenwert liefern wir versandkostenfrei.","3.95"
"1d17878a4c3a8e9e0f02d4189e419fa2","0047375002815","Lourensford Cape Pinotage Roséwein JG 2011","4.99","EUR",,"Roséwein - Südafrika - Stollenbosch. Aus der Selection Alexander von Essen. Dieser herrlich frische First Rosé aus der klassischen Cape-Traube Pinotage begeistert mit seinem blumigen Duft nach Mango und Zitronenmelisse.","Weinkeller / Weinkeller / Roséweine",,"http://shop.edeka24.de/out/pictures/generated/product/1/185_150_90/fl_cape_rose_600.jpg","http://shop.edeka24.de/out/pictures/generated/product/1/380_340_90/fl_cape_rose_600.jpg","Lourensford","http://www.zanox-affiliate.de/ppc/?20301248C727219293&ULP=[[rozXQBbVbnyoPvBJmn8b78-1]]","2",,,"Ab 75 EUR Warenwert liefern wir versandkostenfrei.","3.95"
"a353ab10b594834755eb9442bdbf0ca3","0047375002822","Lourensford Cape White JG 2010","4.99","EUR",,"Südafrika - Stollenbosch. Aus der Selection Alexander von Essen.","Weinkeller / Weißwein / Südafrika Weißwein",,"http://shop.edeka24.de/out/pictures/generated/product/1/185_150_90/fl_cape10_weiss_500_z1.jpg","http://shop.edeka24.de/out/pictures/generated/product/1/380_340_90/fl_cape10_weiss_500_z1.jpg","Lourensford","http://www.zanox-affiliate.de/ppc/?20301248C727219293&ULP=[[aef4ab574226e1731.00787575]]","2",,,"Ab 75 EUR Warenwert liefern wir versandkostenfrei.","3.95"
"01bde22c855c233dc3ec4247718443ed","0047375003269","Penfolds Bin 2 Shiraz Mourvèdre Rotwein JG 2009","19.99","EUR",,"Rotwein - Australien - Südaustralien.","Weinkeller / Rotwein / Australien Rotwein",,"http://shop.edeka24.de/out/pictures/generated/product/1/185_150_90/penfolds_bin2_600_z1.jpg","http://shop.edeka24.de/out/pictures/generated/product/1/380_340_90/penfolds_bin2_600_z1.jpg","Penfolds","http://www.zanox-affiliate.de/ppc/?20301248C727219293&ULP=[[ja54ab89e238e7916.92796749]]","2",,,"Ab 75 EUR Warenwert liefern wir versandkostenfrei.","3.95"
"678bae47b8d5c402635f8597084c3873","0047375003276","Penfolds Bin 28 Kalimna Shiraz Rotwein JG 2009","24.99","EUR",,"Rotwein - Australien. Bin 28 ist das Paradebeispiel für einen australischen Shiraz .","Weinkeller / Rotwein / Australien Rotwein",,"http://shop.edeka24.de/out/pictures/generated/product/1/185_150_90/penfolds_bin28_600_z1.jpg","http://shop.edeka24.de/out/pictures/generated/product/1/380_340_90/penfolds_bin28_600_z1.jpg","Penfolds","http://www.zanox-affiliate.de/ppc/?20301248C727219293&ULP=[[ja54ab89d2964ad69.03061938]]","2",,,"Ab 75 EUR Warenwert liefern wir versandkostenfrei.","3.95"
"49fe36c3ee0607f70055882920fbdbaf","0047375004194","Ziegler Walnussgeist 0,35 ltr","44.99","EUR",,"Der Geistige. Für unseren Walnussgeist verwenden wir die am meisten geschätzten Walnüsse aus Kalifornien.","Spirituosen / Klare Spirituosen / Edelbrand",,"http://shop.edeka24.de/out/pictures/generated/product/1/185_150_90/7pZCa6FTPRsAoGfGWBzBEd-30.jpg","http://shop.edeka24.de/out/pictures/generated/product/1/380_340_90/7pZCa6FTPRsAoGfGWBzBEd-30.jpg","Ziegler","http://www.zanox-affiliate.de/ppc/?20301248C727219293&ULP=[[5kglMAisLFJfvqiGWBzBEd-1]]","2",,,"Ab 75 EUR Warenwert liefern wir versandkostenfrei.","3.95"
"61771531db03d072214bfbec05b84d37","0047375004447","Baron de Ley Las Altillas Rosé JG 2011","6.99","EUR",,"Rosewein - Spanien - Rioja. Aus der Selection Alexander von Essen.","Weinkeller / Weinkeller / Roséweine",,"http://shop.edeka24.de/out/pictures/generated/product/1/185_150_90/lasaltilasrose_300_p1.jpg","http://shop.edeka24.de/out/pictures/generated/product/1/380_340_90/lasaltilasrose_300_p1.jpg","Baron de Ley","http://www.zanox-affiliate.de/ppc/?20301248C727219293&ULP=[[bf84e87b916928bd7.96907186]]","2",,,"Ab 75 EUR Warenwert liefern wir versandkostenfrei.","3.95"
"9171ba548ae0108c855e8a01b50b5d28","0047375004583","Chateau Ricardelle Cuvée Olivettes Rotwein 2009","6.99","EUR",,"Rotwein - Frankreich - Languedoc. Aus der Selection Alexander von Essen.","Weinkeller / Sonderaktionen / Alexander von Essen",,"http://shop.edeka24.de/out/pictures/generated/product/1/185_150_90/frankreichricardelle_500_z1.jpg","http://shop.edeka24.de/out/pictures/generated/product/1/380_340_90/frankreichricardelle_500_z1.jpg","Chateau Ricardelle","http://www.zanox-affiliate.de/ppc/?20301248C727219293&ULP=[[1vp4ab34949046485.39780143]]","2",,,"Ab 75 EUR Warenwert liefern wir versandkostenfrei.","3.95"
"b30ebd470630c407d27ad8771e99b0c3","0047375004804","Ziegler Sauerkirschbrand 0,35 ltr","44.99","EUR",,"Dieser Sauerkirschbrand hat eine feinherbe Note, die dabei den typischen kräftigen Kirschton nicht überdeckt.","Spirituosen / Klare Spirituosen / Edelbrand",,"http://shop.edeka24.de/out/pictures/generated/product/1/185_150_90/K6iIjH7uORsAoGfGWBzBEd-30.jpg","http://shop.edeka24.de/out/pictures/generated/product/1/380_340_90/K6iIjH7uORsAoGfGWBzBEd-30.jpg","Ziegler","http://www.zanox-affiliate.de/ppc/?20301248C727219293&ULP=[[5UoOj2iZvFJfvqiGWBzBEd-1]]","2",,,"Ab 75 EUR Warenwert liefern wir versandkostenfrei.","3.95"
"61a99c5302b8d08a6eabbc1372d7904a","0047375005135","Ziegler Erdbeerlikör 0,35 ltr","24.99","EUR",,"Der Duft reifer Erdbeeren besticht in Kombination mit feinem Erdbeerdestillat. Die Natürlichkeit dieses Produktes überzeugt sofort.","Spirituosen / Klare Spirituosen / Edelbrand",,"http://shop.edeka24.de/out/pictures/generated/product/1/185_150_90/erdbeer_300_p1.jpg","http://shop.edeka24.de/out/pictures/generated/product/1/380_340_90/erdbeer_300_p1.jpg","Ziegler","http://www.zanox-affiliate.de/ppc/?20301248C727219293&ULP=[[6g04b1d06758bec36.78877345]]","2",,,"Ab 75 EUR Warenwert liefern wir versandkostenfrei.","3.95"
"a3eabfc3c3da37f919910fda6285df28","0047375005159","Ziegler Winter-Likör 0,35 ltr","25.99","EUR",,"Nur beste Zutaten wie Pflaumen- und Apfelsaft, eine geheime Gewürzrezeptur, abgerundet mit Orange, Vanille und Zimt. Lieferbar von September bis Januar.","Spirituosen / Klare Spirituosen / Edelbrand",,"http://shop.edeka24.de/out/pictures/generated/product/1/185_150_90/g6iGZvfztP9LoGBJmn8b78-30.jpg","http://shop.edeka24.de/out/pictures/generated/product/1/380_340_90/g6iGZvfztP9LoGBJmn8b78-30.jpg","Ziegler","http://www.zanox-affiliate.de/ppc/?20301248C727219293&ULP=[[t1hOWezNTKhnduiGWBzBEd-1]]","2",,,"Ab 75 EUR Warenwert liefern wir versandkostenfrei.","3.95"
"884ed441e6c9103d38004ac11607c00e","0047375005173","Ziegler Mirabellenbrand 0,35 ltr","41.99","EUR",,"Einzigartig duftige Mirabellen aus Rheinhessen. Zart und delikat am Gaumen, ein Kleinod unter den Obstbränden.","Spirituosen / Klare Spirituosen / Edelbrand",,"http://shop.edeka24.de/out/pictures/generated/product/1/185_150_90/mirabellenbrand_300_p1.jpg","http://shop.edeka24.de/out/pictures/generated/product/1/380_340_90/mirabellenbrand_300_p1.jpg","Ziegler","http://www.zanox-affiliate.de/ppc/?20301248C727219293&ULP=[[8ca4e27e8ce9b33a4.73094851]]","2",,,"Ab 75 EUR Warenwert liefern wir versandkostenfrei.","3.95"
"7c921826af52ebe2cb21db25e5985b69","0047375005340","Bolla Amarone della Valpolicella DOC Classico 2007","29.99","EUR",,"Rotwein - Italien - Veezien.","Weinkeller / Sonderaktionen / Premiumweine",,"http://shop.edeka24.de/out/pictures/generated/product/1/185_150_90/amarone_250_500_z1.jpg","http://shop.edeka24.de/out/pictures/generated/product/1/380_340_90/amarone_250_500_z1.jpg","Bolla","http://www.zanox-affiliate.de/ppc/?20301248C727219293&ULP=[[jj34d2ae8ad28c9d7.29735547]]","2",,,"Ab 75 EUR Warenwert liefern wir versandkostenfrei.","3.95"
"99d5248eeaa807d3da712106e43c3cbc","0047375005425","Sella & Mosca La Cala Vermentino di Sardegna 2011","6.50","EUR",,"Italien - Sardinien.","Weinkeller / Sonderaktionen / Restposten Wein",,"http://shop.edeka24.de/out/pictures/generated/product/1/185_150_90/lacala_500_z1.jpg","http://shop.edeka24.de/out/pictures/generated/product/1/380_340_90/lacala_500_z1.jpg","Sella & Mosca","http://www.zanox-affiliate.de/ppc/?20301248C727219293&ULP=[[fte4bac63527d4c96.38971693]]","2",,,"Ab 75 EUR Warenwert liefern wir versandkostenfrei.","3.95"
"bd021495809b4f7b1b6bdd61f5dbf059","0047375005432","Ziegler Wildkirschgeist Nr.1 0,35 ltr","79.99","EUR",,"Die Edle. Im Glas präsentiert sich dieser Brand rein im Duft, von tiefer Geschmeidigkeit und der Würze der Wildkirsche, nachhaltig im Abgang.","Spirituosen / Klare Spirituosen / Edelbrand",,"http://shop.edeka24.de/out/pictures/generated/product/1/185_150_90/GFV7DtCcUI32UWdGWBzBEd-30.jpg","http://shop.edeka24.de/out/pictures/generated/product/1/380_340_90/GFV7DtCcUI32UWdGWBzBEd-30.jpg","Ziegler","http://www.zanox-affiliate.de/ppc/?20301248C727219293&ULP=[[T1qClY7D6GJfvqiGWBzBEd-1]]","2",,,"Ab 75 EUR Warenwert liefern wir versandkostenfrei.","3.95"
"b95f2d7a26f9c67b1d65dbfb77527c06","0047375005876","Taittinger Champagner Brut Reserve 12 ltr in Holzkiste","999.00","EUR",,"Frankreich. Abgefüllt in der BALTHAZAR-Flasche. Als feinster Aperitif, zu allen feierlichen Anlässen und für den besonderen Augenblick.","Champagner / Sekt / Champagner / Taittinger",,"http://shop.edeka24.de/out/pictures/generated/product/1/185_150_90/12liter_600_z1.jpg","http://shop.edeka24.de/out/pictures/generated/product/1/380_340_90/12liter_600_z1.jpg","Taittinger","http://www.zanox-affiliate.de/ppc/?20301248C727219293&ULP=[[26q49e5bf019fb2b3.84042274]]","2",,,"Ab 75 EUR Warenwert liefern wir versandkostenfrei.","3.95"
"2565f72871dd98333c58a3f945c14a52","0047375006497","El Meson Rioja Gran Reserva Rotwein 2001","21.99","EUR",,"Rotwein - Spanien - Rioja.","Weinkeller / Rotwein / Spanien Rotwein",,"http://shop.edeka24.de/out/pictures/generated/product/1/185_150_90/L8ECkbIUzu8LoGBJmn8b78-30.jpg","http://shop.edeka24.de/out/pictures/generated/product/1/380_340_90/L8ECkbIUzu8LoGBJmn8b78-30.jpg","El Meson","http://www.zanox-affiliate.de/ppc/?20301248C727219293&ULP=[[PFdCsq4tC67LoGBJmn8b78-1]]","2",,,"Ab 75 EUR Warenwert liefern wir versandkostenfrei.","3.95"
"24e38b965dbdc317f75c4386b5042b74","0047375006596","Taittinger Champagner Brut Reserve 6 ltr in Holzkiste","399.99","EUR",,"Frankreich. Abgefüllt in der METHUSALEM-Flasche. Als feinster Aperitif, zu allen feierlichen Anlässen und für den besonderen Augenblick.","Champagner / Sekt / Champagner / Taittinger",,"http://shop.edeka24.de/out/pictures/generated/product/1/185_150_90/6liter_600_z1.jpg","http://shop.edeka24.de/out/pictures/generated/product/1/380_340_90/6liter_600_z1.jpg","Taittinger","http://www.zanox-affiliate.de/ppc/?20301248C727219293&ULP=[[a0j49e5bcb615dd07.24489576]]","2",,,"Ab 75 EUR Warenwert liefern wir versandkostenfrei.","3.95"
"c8ae5df8e6d21269b1105daa0a8fbf8d","0047375006916","Sella & Mosca Oleandro Alghero Rosato DOC 2011","7.50","EUR",,"Roséwein - Italien - Sardinien.","Weinkeller / Weinkeller / Roséweine",,"http://shop.edeka24.de/out/pictures/generated/product/1/185_150_90/orleandro_500_z1.jpg","http://shop.edeka24.de/out/pictures/generated/product/1/380_340_90/orleandro_500_z1.jpg","Sella & Mosca","http://www.zanox-affiliate.de/ppc/?20301248C727219293&ULP=[[fte4bac63a9755fe7.07103709]]","2",,,"Ab 75 EUR Warenwert liefern wir versandkostenfrei.","3.95"
"e057cf014cd320d4b7c1cf5afe22e65b","0047375007025","Ziegler Aprikosenbrand","115.99","EUR",,"","Spirituosen / Klare Spirituosen / Edelbrand",,"http://shop.edeka24.de/out/pictures/generated/product/1/185_150_90/ziegler-07l-aprikosenbrand.jpg","http://shop.edeka24.de/out/pictures/generated/product/1/380_340_90/ziegler-07l-aprikosenbrand.jpg","Ziegler","http://www.zanox-affiliate.de/ppc/?20301248C727219293&ULP=[[06rf8abac00a5d6dd70112a5d50c7e73]]","2",,,"Ab 75 EUR Warenwert liefern wir versandkostenfrei.","3.95"
"75d8f8f618db4199cfec0e013eda8545","0047375007315","The London N°1 Original Blue Gin","36.99","EUR",,"The London N°1 wird aus dem einzigartig reinen Quellwasser der Quellen von Clekenwell, im Norden Londons, gebrannt. Dafür wird bestes englisches Getreide aus Suffolk und Norfolk verwendet.","Spirituosen / Klare Spirituosen / Gin",,"http://shop.edeka24.de/out/pictures/generated/product/1/185_150_90/bluegin750.jpg","http://shop.edeka24.de/out/pictures/generated/product/1/380_340_90/bluegin750.jpg","The London N°1","http://www.zanox-affiliate.de/ppc/?20301248C727219293&ULP=[[20r3de2df84e2562da8c815b6695adc0]]","2",,,"Ab 75 EUR Warenwert liefern wir versandkostenfrei.","3.95"
"10a61d12ecb147de6d352bd16019c332","0047375007509","Robert Mondavi Woodbridge Zinfandel 1,5 ltr Magnum 2008","16.99","EUR",,"Rotwein - USA-Kalifornien. Sofort wunderschön zugänglich, sanft und vollmundig mit samtweich gereiftem Tannin und viel saftiger Rebsortenfrucht.","Weinkeller / Rotwein / Kalifornien Rotwein",,"http://shop.edeka24.de/out/pictures/generated/product/1/185_150_90/zinfadel_magnum_250_300_z1.jpg","http://shop.edeka24.de/out/pictures/generated/product/1/380_340_90/zinfadel_magnum_250_300_z1.jpg","Robert Mondavi","http://www.zanox-affiliate.de/ppc/?20301248C727219293&ULP=[[tge4d53dd619017f6.75184391]]","2",,,"Ab 75 EUR Warenwert liefern wir versandkostenfrei.","3.95"
"a1b0616a71013001ba13ceadb7885dc8","0047375007780","Ziegler Schokoladengeist 0,35 ltr","37.99","EUR",,"Das Zusammenspiel der herben Edelbitterschokolade von Valrohna verleiht diesem Geist ein schokoladig feines Aroma.","Spirituosen / Klare Spirituosen / Edelbrand",,"http://shop.edeka24.de/out/pictures/generated/product/1/185_150_90/035lschokoladengeist_300_p1.jpg","http://shop.edeka24.de/out/pictures/generated/product/1/380_340_90/035lschokoladengeist_300_p1.jpg","Ziegler","http://www.zanox-affiliate.de/ppc/?20301248C727219293&ULP=[[3rm4bc5c5f0bcd873.49705584]]","2",,,"Ab 75 EUR Warenwert liefern wir versandkostenfrei.","3.95"
"7dc34a7ca3850812e3d74b24627968e8","0047375007803","Ziegler Gravensteiner Apfelbrand 0,35 ltr","36.99","EUR",,"Kernobst-Edelbrand - der Klassiker. Das ist Frische in vollendet-zartherber Anmut. Ein Bild von grünen Wiesen und blühenden Bäumen.","Spirituosen / Klare Spirituosen / Edelbrand",,"http://shop.edeka24.de/out/pictures/generated/product/1/185_150_90/EcwY5reiNRsAoGfGWBzBEd-30.jpg","http://shop.edeka24.de/out/pictures/generated/product/1/380_340_90/EcwY5reiNRsAoGfGWBzBEd-30.jpg","Ziegler","http://www.zanox-affiliate.de/ppc/?20301248C727219293&ULP=[[H9OWN77lLEJfvqiGWBzBEd-1]]","2",,,"Ab 75 EUR Warenwert liefern wir versandkostenfrei.","3.95"
"f30ab6ac6de88461cead6d1f6f8aa32e","0047375007827","Danzka Premium Vodka Cranberyraz","16.99","EUR",,"In der Nase fruchtige Note von Waldfrüchten  am Gaumen wird die Süße von Himbeeren durch die leicht herbe Note der Cranberry ausgeglichen.","Spirituosen / Klare Spirituosen / Vodka",,"http://shop.edeka24.de/out/pictures/generated/product/1/185_150_90/danzzka_vod_cranber_500_z1.jpg","http://shop.edeka24.de/out/pictures/generated/product/1/380_340_90/danzzka_vod_cranber_500_z1.jpg","Danzka","http://www.zanox-affiliate.de/ppc/?20301248C727219293&ULP=[[2t84d6d035ce3c661.51940551]]","2",,,"Ab 75 EUR Warenwert liefern wir versandkostenfrei.","3.95"
"d8d68a0a5cab690325cf99ead23384b0","0047375008226","Angostura Caribbean Rum 5 Jahre","20.99","EUR",,"Premium Rum von Trinidad & Tobago","Spirituosen / Dunkle Spirituosen / Rum",,"http://shop.edeka24.de/out/pictures/generated/product/1/185_150_90/angostura-rum-5-jahre_500.jpg","http://shop.edeka24.de/out/pictures/generated/product/1/380_340_90/angostura-rum-5-jahre_500.jpg","Angostura","http://www.zanox-affiliate.de/ppc/?20301248C727219293&ULP=[[8ca4e27ed1b15d0a9.67755615]]","2",,,"Ab 75 EUR Warenwert liefern wir versandkostenfrei.","3.95"
"2135ec5ca576feb579efc82b54df4849","0047375008653","Ziegler Obstbrand aus Äpfel und Birnen 0,35 ltr","20.99","EUR",,"Der Klassiker. Nur Äpfel und Birnen von den Streuobstwiesen unserer Region werden für den Obstbrand verarbeitet keine Edelsorten sondern die originären süß-sauren Früchte verschiedenster Sorten.","Spirituosen / Klare Spirituosen / Edelbrand",,"http://shop.edeka24.de/out/pictures/generated/product/1/185_150_90/LUiAZw2TbI32UWdGWBzBEd-30.jpg","http://shop.edeka24.de/out/pictures/generated/product/1/380_340_90/LUiAZw2TbI32UWdGWBzBEd-30.jpg","Ziegler","http://www.zanox-affiliate.de/ppc/?20301248C727219293&ULP=[[U1ButWQeTDJfvqiGWBzBEd-1]]","2",,,"Ab 75 EUR Warenwert liefern wir versandkostenfrei.","3.95"
"a6cc957f851cb8c508325faf51faf8c7","0047375008707","Man Vintners Sauvignon Blanc Western 2012","5.49","EUR",,"Weißwein - Südafrika - Coastal","Weinkeller / Weißwein / Südafrika Weißwein",,"http://shop.edeka24.de/out/pictures/generated/product/1/185_150_90/sauvignon_blanc_western_290222.png","http://shop.edeka24.de/out/pictures/generated/product/1/380_340_90/sauvignon_blanc_western_290222.png","Man Vintners","http://www.zanox-affiliate.de/ppc/?20301248C727219293&ULP=[[nqu67417d34564b6ccb00e49b022bc53]]","2",,,"Ab 75 EUR Warenwert liefern wir versandkostenfrei.","3.95"
"06d2995af3bafd2f24ade0e9685be783","0047375008714","Man Vintners Rosé 2011","5.49","EUR",,"Roséwein - Südafrika - Coastal","Weinkeller / Roséweine",,"http://shop.edeka24.de/out/pictures/generated/product/1/185_150_90/man_vintners_ros_29022309.png","http://shop.edeka24.de/out/pictures/generated/product/1/380_340_90/man_vintners_ros_29022309.png","Man Vintners","http://www.zanox-affiliate.de/ppc/?20301248C727219293&ULP=[[nquacca9adf618c5d560c3081eb66c91]]","2",,,"Ab 75 EUR Warenwert liefern wir versandkostenfrei.","3.95"
"2e0268fe7b302c831dba14fbe806bcb4","0047375008721","Man Vintners Cabernet Sauvignon 2010","5.49","EUR",,"Rotwein - Südafrika - Coastal","Weinkeller / Rotwein / Südafrika Rotwein",,"http://shop.edeka24.de/out/pictures/generated/product/1/185_150_90/man_vintners_cabernet_sauvignon__29022408.png","http://shop.edeka24.de/out/pictures/generated/product/1/380_340_90/man_vintners_cabernet_sauvignon__29022408.png","Man Vintners","http://www.zanox-affiliate.de/ppc/?20301248C727219293&ULP=[[nqu8280b8fa6ef3f3730de7284c94321]]","2",,,"Ab 75 EUR Warenwert liefern wir versandkostenfrei.","3.95"
"74efe9d018dcbe9ec5e7d166c23ac1e0","0047375008745","Man Vintners Shiraz 2010","5.49","EUR",,"Rotwein - Südafrika -Coastal","Weinkeller / Rotwein / Südafrika Rotwein",,"http://shop.edeka24.de/out/pictures/generated/product/1/185_150_90/man_vintners_shiraz_290226.png","http://shop.edeka24.de/out/pictures/generated/product/1/380_340_90/man_vintners_shiraz_290226.png","Man Vintners","http://www.zanox-affiliate.de/ppc/?20301248C727219293&ULP=[[nqua2555f0187f702cee8d3539bdd0a2]]","2",,,"Ab 75 EUR Warenwert liefern wir versandkostenfrei.","3.95"
"cc7f57945c619bcf8f01714625e833d5","0047375009083","Domäne Wachau Zweigelt Rosé Himmelstiege trocken","7.99","EUR",,"Roséwein - Österreich","Weinkeller / Roséweine",,"http://shop.edeka24.de/out/pictures/generated/product/1/185_150_90/himmelsteige.gif","http://shop.edeka24.de/out/pictures/generated/product/1/380_340_90/himmelsteige.gif","Domäne Wachau","http://www.zanox-affiliate.de/ppc/?20301248C727219293&ULP=[[1n6592d21bbb3a0da7b70f99da30aeae]]","2",,,"Ab 75 EUR Warenwert liefern wir versandkostenfrei.","3.95"
