"Zupid","sku","ProductName","ProductPrice","CurrencySymbolOfPrice","ValidFromDate","ProductShortDescription","MerchantProductCategory","ZanoxCategoryIds","ImageSmallURL","ImageMediumURL","ProductManufacturerBrand","ZanoxProductLink","DeliveryTime","TermsOfContract","ISBN","ShippingAndHandling","ShippingAndHandlingCost"
"4f43b2ea434ce2115e75761a3c89da32","0003023001430","Greenore 8 Jahre Single Grain Irish Whiskey","25.99","EUR",,"Irland. Greenore ist ein einzigartiger Irish Whiskey aus dem Hause Cooley. Er ist kein Blend aus Malt und Grain Whiskey, wie allgemein üblich, sondern ausschließlich aus Grain Whiskey hergestellt.","Geschenke / Alkoholische Geschenke / Whisky Geschenke",,"http://shop.edeka24.de/out/pictures/generated/product/1/185_150_90/greenore_500_z1.jpg","http://shop.edeka24.de/out/pictures/generated/product/1/380_340_90/greenore_500_z1.jpg","Greenore","http://www.zanox-affiliate.de/ppc/?20301248C727219293&ULP=[[mv44cac91c2c98e65.31601463]]","2",,,"Ab 75 EUR Warenwert liefern wir versandkostenfrei.","3.95"
"a0e51ecbbb6c0d707499bfd448fecc03","0003023002266","Cooley Distillery Irish Miniatur Whiskey Collection","14.49","EUR",,"Tolles Geschenkset bestehend aus 4 Whiskey aus dem Haus Cooley.","Spirituosen / Whisky / Geschenksets",,"http://shop.edeka24.de/out/pictures/generated/product/1/185_150_90/miniaturwhiskey_500_z1.jpg","http://shop.edeka24.de/out/pictures/generated/product/1/380_340_90/miniaturwhiskey_500_z1.jpg","Cooley Distillery","http://www.zanox-affiliate.de/ppc/?20301248C727219293&ULP=[[8o04cac934182e089.32806156]]","2",,,"Ab 75 EUR Warenwert liefern wir versandkostenfrei.","3.95"
"36ad68b4b892c2280be4c48d540b5b89","0003030000123","Papidoux Calvados X.O.","18.49","EUR",,"Nur eine kleine Anzahl von Fässern, in denen sich das feine Destillat aus Cidre besonders gut entwickelt, wird zur Reifung für diesen eleganten und großen Calvados auserlesen.","Spirituosen / Dunkle Spirituosen / Calvados",,"http://shop.edeka24.de/out/pictures/generated/product/1/185_150_90/CxXrR3EUWIQivdlGWBzBEd-30.jpg","http://shop.edeka24.de/out/pictures/generated/product/1/380_340_90/CxXrR3EUWIQivdlGWBzBEd-30.jpg","Papidoux","http://www.zanox-affiliate.de/ppc/?20301248C727219293&ULP=[[uGnCviPRABzhKolGWBzBEd-1]]","2",,,"Ab 75 EUR Warenwert liefern wir versandkostenfrei.","3.95"
"734ad2f64c30222c7dc7a060c9ec81fb","0003030000130","Papidoux Calvados 15 Jahre","22.49","EUR",,"Papidoux Hors D'Age hat nach 15 Jahren Faßlager die Reife des Alters, unvergleichlichen Harmonie und Geschmacksfülle sowie die ausgewählte Finesse eines Calvados der höchsten Qualitätsstufe.","Spirituosen / Dunkle Spirituosen / Calvados",,"http://shop.edeka24.de/out/pictures/generated/product/1/185_150_90/QMrnPe0ZsIQivdlGWBzBEd-30.jpg","http://shop.edeka24.de/out/pictures/generated/product/1/380_340_90/QMrnPe0ZsIQivdlGWBzBEd-30.jpg","Papidoux","http://www.zanox-affiliate.de/ppc/?20301248C727219293&ULP=[[a3sycT5SABzhKolGWBzBEd-1]]","2",,,"Ab 75 EUR Warenwert liefern wir versandkostenfrei.","3.95"
"b8e78a8f31355ac0da89d0b95478123a","0003030000178","Williams Humbert Dry Sack Solera Especial Sherry 15 Jahre","17.99","EUR",,"Dry Sack Solera Especial 15 Jahre ist mit das Feinste, was das weltberühmte Sherry-Haus Williams+Humbert zubereitet. Dry Sack Solera Especial schmeckt rosinig-süß und doch mit Säurebiss und Tiefe.","Weinkeller / Portwein & Sherry",,"http://shop.edeka24.de/out/pictures/generated/product/1/185_150_90/williamsdrysack_15yo_500_z1.jpg","http://shop.edeka24.de/out/pictures/generated/product/1/380_340_90/williamsdrysack_15yo_500_z1.jpg","Williams Humbert","http://www.zanox-affiliate.de/ppc/?20301248C727219293&ULP=[[c9pAlxfX0BzhKolGWBzBEd-1]]","2",,,"Ab 75 EUR Warenwert liefern wir versandkostenfrei.","3.95"
"a0aaddb635b94a6f79fecc5e539d993e","0003863000208","Wild Turkey 8 Jahre Bourbon 101 Proof","24.95","EUR",,"Er wird mit höchster Sorgfalt im Herzen von Kentucky hergestellt, ist von glatter, kräftiger Farbe und verfügt über ein außergewöhnlich leichtes Aroma mit reichen Karamell-, Vanille- und Honignoten.","Whisky / Alter / 0 - 10 Jahre",,"http://shop.edeka24.de/out/pictures/generated/product/1/185_150_90/wildturkey8_300_p1.jpg","http://shop.edeka24.de/out/pictures/generated/product/1/380_340_90/wildturkey8_300_p1.jpg","Wild Turkey","http://www.zanox-affiliate.de/ppc/?20301248C727219293&ULP=[[fpe4b4ded9ae36520.38845403]]","2",,,"Ab 75 EUR Warenwert liefern wir versandkostenfrei.","3.95"
"d7f24c1c48c8bb65f46e08afec558838","0003863000209","Wild Turkey American Honey","24.49","EUR",,"American Bourbon mit Honig-Liqueur verfeinert.","Spirituosen / Whisky / Whisky-Liqueur",,"http://shop.edeka24.de/out/pictures/generated/product/1/185_150_90/americanhoney.jpg","http://shop.edeka24.de/out/pictures/generated/product/1/380_340_90/americanhoney.jpg","Wild Turkey","http://www.zanox-affiliate.de/ppc/?20301248C727219293&ULP=[[pc91b7aedab83f90430713e6463dd078]]","2",,,"Ab 75 EUR Warenwert liefern wir versandkostenfrei.","3.95"
"414684fe26e14143af60aa5072a81ef7","00043519001195","Chateau du Breuil Calvados 8 Jahre","39.99","EUR",,"Nur der feinste und ausgewogenste Calvados trägt den Namen Chateau du Breuil. In dieser renommierten normannischen Destillerie vereinen sich die Liebe zum Handwerk und der Respekt von der traditionsreichen Calvadosherstellung.","Spirituosen / Dunkle Spirituosen / Calvados",,"http://shop.edeka24.de/out/pictures/generated/product/1/185_150_90/a5A5EYvT5XD9fdjGWBzBEd-30.jpg","http://shop.edeka24.de/out/pictures/generated/product/1/380_340_90/a5A5EYvT5XD9fdjGWBzBEd-30.jpg","Chateau du Breuil","http://www.zanox-affiliate.de/ppc/?20301248C727219293&ULP=[[0K9LoVRXn8GJGNdGWBzBEd-1]]","2",,,"Ab 75 EUR Warenwert liefern wir versandkostenfrei.","3.95"
"36530f67be4b61af8f0e2968394e4392","00043519001196","Chateau du Breuil Calvados VSOP","25.99","EUR",,"Reich an Tradition und frisch im Geschmack präsentiert sich dieser Calvados. Mindestens vier Jahre Alterung geben dem Calvados Château du Breuil VSOP die Geschmeidigkeit und seine bernsteinerne Farbe.","Spirituosen / Dunkle Spirituosen / Calvados",,"http://shop.edeka24.de/out/pictures/generated/product/1/185_150_90/9y8mccrrCmdJqUEJmn8b78-30.jpg","http://shop.edeka24.de/out/pictures/generated/product/1/380_340_90/9y8mccrrCmdJqUEJmn8b78-30.jpg","Chateau du Breuil","http://www.zanox-affiliate.de/ppc/?20301248C727219293&ULP=[[FzAFzUvHimdJqUEJmn8b78-1]]","2",,,"Ab 75 EUR Warenwert liefern wir versandkostenfrei.","3.95"
"67599c2ca7a56345b8682afdffff279d","00043519001201","Chateau du Breuil Calvados 15 Jahre","48.99","EUR",,"In dieser renommierten normannischen Destillerie vereinen sich die Liebe zum Handwerk und der Respekt von der traditionsreichen Calvadosherstellung.","Spirituosen / Dunkle Spirituosen / Calvados",,"http://shop.edeka24.de/out/pictures/generated/product/1/185_150_90/xjeXOZBn5XD9fdjGWBzBEd-30.jpg","http://shop.edeka24.de/out/pictures/generated/product/1/380_340_90/xjeXOZBn5XD9fdjGWBzBEd-30.jpg","Chateau du Breuil","http://www.zanox-affiliate.de/ppc/?20301248C727219293&ULP=[[cJZToTzIu8GJGNdGWBzBEd-1]]","2",,,"Ab 75 EUR Warenwert liefern wir versandkostenfrei.","3.95"
"f046b07fb3c5ed43108230d4d3580e45","0004439000001","Grey Goose Super Premium Vodka","37.99","EUR",,"Der Super Premium Vodka für Hedonisten und Szenekenner, die das Außergewöhnliche suchen. Seine Zutaten und sein Herstellungsverfahren machen ihn zum bevorzugten Wodka für Liebhaber des Gaumen-Luxus.","Spirituosen / Klare Spirituosen / Vodka",,"http://shop.edeka24.de/out/pictures/generated/product/1/185_150_90/greygoose_500_z1.jpg","http://shop.edeka24.de/out/pictures/generated/product/1/380_340_90/greygoose_500_z1.jpg","Grey Goose","http://www.zanox-affiliate.de/ppc/?20301248C727219293&ULP=[[ihdp0s68M0rAoGfGWBzBEd-1]]","2",,,"Ab 75 EUR Warenwert liefern wir versandkostenfrei.","3.95"
"84d18f42d9b58dd7f206cdc314aad8dc","0004439000003","Bacardi Razz flavored Rum 1 ltr","22.49","EUR",,"Sanfter BACARDI Rum, harmonisch abgestimmt mit aromatischen Noten von Himbeere, Erdbeere und Zitrone.","Spirituosen / Dunkle Spirituosen / Rum",,"http://shop.edeka24.de/out/pictures/generated/product/1/185_150_90/bacardirazz_1l_500_z1.jpg","http://shop.edeka24.de/out/pictures/generated/product/1/380_340_90/bacardirazz_1l_500_z1.jpg","Bacardi","http://www.zanox-affiliate.de/ppc/?20301248C727219293&ULP=[[Gc7z5srbjRr8rkjGWBzBEd-1]]","2",,,"Ab 75 EUR Warenwert liefern wir versandkostenfrei.","3.95"
"082981dabc92e787765fa920822bdf48","0004439000004","Bacardi Limon flavored Rum 1 ltr","19.79","EUR",,"Die erfrischende, aromatisierte Variante des beliebten Rums BACARDI Carta Blanca.","Spirituosen / Dunkle Spirituosen / Rum",,"http://shop.edeka24.de/out/pictures/generated/product/1/185_150_90/limon_1l_500_z1.jpg","http://shop.edeka24.de/out/pictures/generated/product/1/380_340_90/limon_1l_500_z1.jpg","Bacardi","http://www.zanox-affiliate.de/ppc/?20301248C727219293&ULP=[[or8oPlMvCboz7wmGWBzBEd-1]]","2",,,"Ab 75 EUR Warenwert liefern wir versandkostenfrei.","3.95"
"e2616b2a3fedc5ffa9282421e67f5a74","0004439000011","MICHALSKY for GREY GOOSE Super Premium Grey Goose Vodka","99.00","EUR",,"in limitierter Geschenkverpackung. Entworfen von dem Berliner Stardesigner MICHAEL MICHALSKY. Auf 499 Stück weltweit limitiert! Der Super Premium Vodka für Hedonisten und Szenekenner, die das Außergewöhnliche suchen.","Spirituosen / Klare Spirituosen / Vodka",,"http://shop.edeka24.de/out/pictures/generated/product/1/185_150_90/skx9RB9IuHXRlUhGWBzBEd-30.jpg","http://shop.edeka24.de/out/pictures/generated/product/1/380_340_90/skx9RB9IuHXRlUhGWBzBEd-30.jpg","MICHALSKY for GREY GOOSE","http://www.zanox-affiliate.de/ppc/?20301248C727219293&ULP=[[VviKp9vZiHXRlUhGWBzBEd-1]]","2",,,"Ab 75 EUR Warenwert liefern wir versandkostenfrei.","3.95"
"20dedd00edf8e15a5297b879e90e53bc","0004439000012","Dewar's 12 Jahre Special Reserve Blended Malt Whisky","27.90","EUR",,"Schottland. Durch das Marrying, die Hochzeit und gemeinsame Reife der edlen Bestandteile, gelingt ein prachtvoller Whisky von besonderer Weichheit und Harmonie.","Whisky / Alter / 11 - 20 Jahre",,"http://shop.edeka24.de/out/pictures/generated/product/1/185_150_90/dewar-whisky-12-jahre-750.jpg","http://shop.edeka24.de/out/pictures/generated/product/1/380_340_90/dewar-whisky-12-jahre-750.jpg","Dewar's","http://www.zanox-affiliate.de/ppc/?20301248C727219293&ULP=[[vp5uVFlVP23jvdlGWBzBEd-1]]","2",,,"Ab 75 EUR Warenwert liefern wir versandkostenfrei.","3.95"
"70f012cdf1845ba0f8f6e20b77b695fa","0004439000016","Aberfeldy 12 Jahre Single Malt Whisky","31.90","EUR",,"Single Malt Scotch Whisky. Herz dieses seidigen Malts einer kleinen Brennerei in den Highlands sind Heide und Berghonig. Unser Geheimtipp!","Weinkeller / Sonderaktionen / Restposten Wein",,"http://shop.edeka24.de/out/pictures/generated/product/1/185_150_90/aberfeldy_12_500_z1.jpg","http://shop.edeka24.de/out/pictures/generated/product/1/380_340_90/aberfeldy_12_500_z1.jpg","Aberfeldy","http://www.zanox-affiliate.de/ppc/?20301248C727219293&ULP=[[QTEsxznVe33jvdlGWBzBEd-1]]","2",,,"Ab 75 EUR Warenwert liefern wir versandkostenfrei.","3.95"
"64f742b39f7199654a9ad52860b8ce0f","0004439000044","Bacardi Limon flavored Rum","14.49","EUR",,"Die erfrischende, aromatisierte Variante des beliebten Rums BACARDI Carta Blanca.","Spirituosen / Dunkle Spirituosen / Rum",,"http://shop.edeka24.de/out/pictures/generated/product/1/185_150_90/limon_07l_500_z1.jpg","http://shop.edeka24.de/out/pictures/generated/product/1/380_340_90/limon_07l_500_z1.jpg","Bacardi","http://www.zanox-affiliate.de/ppc/?20301248C727219293&ULP=[[5v24b4b31bcdd1663.31568515]]","2",,,"Ab 75 EUR Warenwert liefern wir versandkostenfrei.","3.95"
"2d41aa4a766628186c9d8ccac54ce8b5","0004439000154","Baron Otard Cognac Gold XO","99.00","EUR",,"Otard Cognac reift durchschnittlich 35 Jahre in Eichenfässern, bevor der Kellermeister die unterschiedlichen Destillate vermählt, d.h. Brände verschiedenen Alters und Charakters zu einem harmonischen Ganzen zusammenführt.","Spirituosen / Dunkle Spirituosen / Cognac",,"http://shop.edeka24.de/out/pictures/generated/product/1/185_150_90/otardxogold_500_z1.jpg","http://shop.edeka24.de/out/pictures/generated/product/1/380_340_90/otardxogold_500_z1.jpg","Baron Otard","http://www.zanox-affiliate.de/ppc/?20301248C727219293&ULP=[[x1sKS3YY0BzhKolGWBzBEd-1]]","2",,,"Ab 75 EUR Warenwert liefern wir versandkostenfrei.","3.95"
"8003c6c7bab2f1969b4df1fc373b2f54","0004439000215","Jack Daniels Gentleman Jack Rare Whiskey","25.99","EUR",,"Die Premium-Abfüllung der Jack-Daniel-Distillerie!","Whisky / Alter / 0 - 10 Jahre",,"http://shop.edeka24.de/out/pictures/generated/product/1/185_150_90/jackgentleman_500_z1.jpg","http://shop.edeka24.de/out/pictures/generated/product/1/380_340_90/jackgentleman_500_z1.jpg","Jack Daniels","http://www.zanox-affiliate.de/ppc/?20301248C727219293&ULP=[[4D2ZrcO01BzhKolGWBzBEd-1]]","2",,,"Ab 75 EUR Warenwert liefern wir versandkostenfrei.","3.95"
"a328c6dd761aec37af1fc0bc409224ca","0004439000406","Conde de Osborne Brandy Gran Reserva","24.99","EUR",,"Spanien. GOLDMEDAILLE Internationaler Spirituosenwettbewerb 2008. Ergebnis wahrer Kunstarbeit mit einer Tradition von über 200 Jahren, wo das ganze Wissen, Erfahrung und Zuwendung der Spanier zusammentreffen.","Dunkle Spirituosen / Brandy & Weinbrand / Osborne Brandy",,"http://shop.edeka24.de/out/pictures/generated/product/1/185_150_90/bDIXoa4WZG5nIIvJmn8b78-30.jpg","http://shop.edeka24.de/out/pictures/generated/product/1/380_340_90/bDIXoa4WZG5nIIvJmn8b78-30.jpg","Conde de Osborne","http://www.zanox-affiliate.de/ppc/?20301248C727219293&ULP=[[5LlmQFXzijzUk1iGWBzBEd-1]]","2",,,"Ab 75 EUR Warenwert liefern wir versandkostenfrei.","3.95"
"a27ce2513652fcacc97ba01db2e938c3","0004737500120","Angostura Old dark Rum 7 Jahre","22.95","EUR",,"Premium Rum von Trinidad & Tobago. RUM DES JAHRES Internationaler Sprituosen-Wettbewerb 2006.","Spirituosen / Dunkle Spirituosen / Rum",,"http://shop.edeka24.de/out/pictures/generated/product/1/185_150_90/angostura-rum-7-jahre_500.jpg","http://shop.edeka24.de/out/pictures/generated/product/1/380_340_90/angostura-rum-7-jahre_500.jpg","Angostura","http://www.zanox-affiliate.de/ppc/?20301248C727219293&ULP=[[dNFxik7aPkoeqVuJmn8b78-1]]","2",,,"Ab 75 EUR Warenwert liefern wir versandkostenfrei.","3.95"
"704915f5c86bea414392d2a8a586dcaf","0006183001256","Heilemann Confiserie Auslese für Genießer Praliné-Composition","6.95","EUR",,"Erlesene Confiserie-Pralinés nach klassischer Rezeptur.","Kaffee / Feinkost / Feinkost / Heilemann Confiserie",,"http://shop.edeka24.de/out/pictures/generated/product/1/185_150_90/auslesefrgenieer2.jpg","http://shop.edeka24.de/out/pictures/generated/product/1/380_340_90/auslesefrgenieer2.jpg","Heilemann Confiserie","http://www.zanox-affiliate.de/ppc/?20301248C727219293&ULP=[[aq14b21faef7f6796.08557390]]","2",,,"Ab 75 EUR Warenwert liefern wir versandkostenfrei.","3.95"
"3dc16506a50d86b6a90f256d472b40da","0006183001355","Heilemann Confiserie Hochfeine Praliné-Composition ohne Alkohol","6.95","EUR",,"Erlesene Confiserie-Pralinés ohne Alkohol.","Kaffee / Feinkost / Feinkost / Heilemann Confiserie",,"http://shop.edeka24.de/out/pictures/generated/product/1/185_150_90/pralinsohnealkohol125g.jpg","http://shop.edeka24.de/out/pictures/generated/product/1/380_340_90/pralinsohnealkohol125g.jpg","Heilemann Confiserie","http://www.zanox-affiliate.de/ppc/?20301248C727219293&ULP=[[aq14b21f7aeb4a211.93900027]]","2",,,"Ab 75 EUR Warenwert liefern wir versandkostenfrei.","3.95"
"e11d9c724d1b10fb7a7fb24e9ad2ed24","0006183001409","Heilemann Confiserie Hochfeine Marzipan Praliné-Composition","6.95","EUR",,"Erlesene Marzipan-Pralinés nach raffinierten Rezepturen.","Kaffee / Feinkost / Feinkost / Heilemann Confiserie",,"http://shop.edeka24.de/out/pictures/generated/product/1/185_150_90/marzipancomposition125g.jpg","http://shop.edeka24.de/out/pictures/generated/product/1/380_340_90/marzipancomposition125g.jpg","Heilemann Confiserie","http://www.zanox-affiliate.de/ppc/?20301248C727219293&ULP=[[o2m4b20b0c8de95d1.41721723]]","2",,,"Ab 75 EUR Warenwert liefern wir versandkostenfrei.","3.95"
"4f5ec7089db21fa178aa7bdc896ee046","0007469060057","Mydays Magic Box Kuschelwochenende für Zwei","199.00","EUR",,"Von den Bayerischen Alpen bis zu urbanen Metropolen.","Geschenke / Mydays Erlebnisgutscheine",,"http://shop.edeka24.de/out/pictures/generated/product/1/185_150_90/magicbox_kuwo_rgb_300_p1.jpg","http://shop.edeka24.de/out/pictures/generated/product/1/380_340_90/magicbox_kuwo_rgb_300_p1.jpg","Mydays Magic Box","http://www.zanox-affiliate.de/ppc/?20301248C727219293&ULP=[[d0h4d08e1e4afb970.59600606]]","2",,,"Ab 75 EUR Warenwert liefern wir versandkostenfrei.","3.95"
"a32037666b3be863f95a9955da902a3f","0007469060071","Mydays Magic Box Kleine Liebesnester für Zwei","99.00","EUR",,"Einfach abtauchen, abschalten und genießen.","Geschenke / Mydays Erlebnisgutscheine",,"http://shop.edeka24.de/out/pictures/generated/product/1/185_150_90/magicbox_kleineliebesnester_300_p1.jpg","http://shop.edeka24.de/out/pictures/generated/product/1/380_340_90/magicbox_kleineliebesnester_300_p1.jpg","Mydays Magic Box","http://www.zanox-affiliate.de/ppc/?20301248C727219293&ULP=[[d0h4d08e3252765a0.68505825]]","2",,,"Ab 75 EUR Warenwert liefern wir versandkostenfrei.","3.95"
"ca7ea40f3b507e9c3ab375bdd4ba1738","0007469060088","Mydays Magic Box Städtetrips für Zwei","79.00","EUR",,"Es gibt viel zu entdecken!","Geschenke / Mydays Erlebnisgutscheine",,"http://shop.edeka24.de/out/pictures/generated/product/1/185_150_90/magicbox_staedtetrips_rgb_3_p1.jpg","http://shop.edeka24.de/out/pictures/generated/product/1/380_340_90/magicbox_staedtetrips_rgb_3_p1.jpg","Mydays Magic Box","http://www.zanox-affiliate.de/ppc/?20301248C727219293&ULP=[[d0h4d08e27baaf476.01225061]]","2",,,"Ab 75 EUR Warenwert liefern wir versandkostenfrei.","3.95"
"845a29f7d069cff2bc18b15d9c803394","0007469060095","Mydays Magic Box Fun und Action","79.00","EUR",,"Ein Freizeitspaß der Extraklasse.","Geschenke / Mydays Erlebnisgutscheine",,"http://shop.edeka24.de/out/pictures/generated/product/1/185_150_90/magicbox_funuaction_300_p1.jpg","http://shop.edeka24.de/out/pictures/generated/product/1/380_340_90/magicbox_funuaction_300_p1.jpg","Mydays Magic Box","http://www.zanox-affiliate.de/ppc/?20301248C727219293&ULP=[[d0h4d08e556f133f7.24004244]]","2",,,"Ab 75 EUR Warenwert liefern wir versandkostenfrei.","3.95"
"25d412f195a4bcbda3be48b676c4e8f0","0011111000102","Online-Gutschein EWORLD24.de über 20 Euro","20.00","EUR",,"einzulösen bei www.eWorld24.de","Geschenke / Gutscheine",,"http://shop.edeka24.de/out/pictures/generated/product/1/185_150_90/eworld24-gutschein.jpg","http://shop.edeka24.de/out/pictures/generated/product/1/380_340_90/eworld24-gutschein.jpg","Online-Gutschein","http://www.zanox-affiliate.de/ppc/?20301248C727219293&ULP=[[IrUNDHU75BzhKolGWBzBEd-1]]","2",,,"Ab 75 EUR Warenwert liefern wir versandkostenfrei.","3.95"
"6836c34b8040fd7dc1290a95b1bbc64f","0011111000103","Online-Gutschein EWORLD24.de über 50 Euro","50.00","EUR",,"einzulösen bei www.eWorld24.de","Geschenke / Gutscheine",,"http://shop.edeka24.de/out/pictures/generated/product/1/185_150_90/eworld24-gutschein(1).jpg","http://shop.edeka24.de/out/pictures/generated/product/1/380_340_90/eworld24-gutschein(1).jpg","Online-Gutschein","http://www.zanox-affiliate.de/ppc/?20301248C727219293&ULP=[[hdzIlxa85BzhKolGWBzBEd-1]]","2",,,"Ab 75 EUR Warenwert liefern wir versandkostenfrei.","3.95"
"e5dd0bbd242c0736cfa505459e0982b5","0011111000104","Online-Gutschein EWORLD24.de über 100 Euro","100.00","EUR",,"einzulösen bei www.eWorld24.de","Geschenke / Gutscheine",,"http://shop.edeka24.de/out/pictures/generated/product/1/185_150_90/eworld24-gutschein(2).jpg","http://shop.edeka24.de/out/pictures/generated/product/1/380_340_90/eworld24-gutschein(2).jpg","Online-Gutschein","http://www.zanox-affiliate.de/ppc/?20301248C727219293&ULP=[[29g8htq85BzhKolGWBzBEd-1]]","2",,,"Ab 75 EUR Warenwert liefern wir versandkostenfrei.","3.95"
"f9faac1c645ed5b6dad21d927a02992d","0011239000001","Conte di Lucca Riserva Rotwein 2007 - schwarzes Design","4.99","EUR",,"Rotwein - Italien - Apulien. Über 12 Monate gereift , oplulentes Bukett, volle Frucht.","Weinkeller / Sonderaktionen / Restposten Wein",,"http://shop.edeka24.de/out/pictures/generated/product/1/185_150_90/510019-ef.jpg","http://shop.edeka24.de/out/pictures/generated/product/1/380_340_90/510019-ef.jpg","Conte di Lucca","http://www.zanox-affiliate.de/ppc/?20301248C727219293&ULP=[[hmsd8ec5ecf093082990e9795cdec424]]","2",,,"Ab 75 EUR Warenwert liefern wir versandkostenfrei.","3.95"
"6ab63e276035e493936a2d0c43167c3e","0011239000994","Absente Absinthe mit 55% Vol.","23.99","EUR",,"Absente Henri Bardouin. Südfrankreich.","Spirituosen / Dunkle Spirituosen / Absinth",,"http://shop.edeka24.de/out/pictures/generated/product/1/185_150_90/absente-absinthe-mit-geschenkverpackung.jpg","http://shop.edeka24.de/out/pictures/generated/product/1/380_340_90/absente-absinthe-mit-geschenkverpackung.jpg","Absente","http://www.zanox-affiliate.de/ppc/?20301248C727219293&ULP=[[c284d997dd7416698.48581684]]","2",,,"Ab 75 EUR Warenwert liefern wir versandkostenfrei.","3.95"
"03ffbfced527886809f07bb619eab2ae","0011239001201","Conte di Lucca Riserva Rotwein 2007","5.69","EUR",,"Rotwein - Italien - Apulien. Über 12 Monate gereift , oplulentes Bukett, volle Frucht.","Weinkeller / Rotwein / Italien Rotwein",,"http://shop.edeka24.de/out/pictures/generated/product/1/185_150_90/contedilucca2.png","http://shop.edeka24.de/out/pictures/generated/product/1/380_340_90/contedilucca2.png","Conte di Lucca","http://www.zanox-affiliate.de/ppc/?20301248C727219293&ULP=[[PxUflq7ioKr8rkjGWBzBEd-1]]","2",,,"Ab 75 EUR Warenwert liefern wir versandkostenfrei.","3.95"
"96778a67ca5e9708d9a9d54fda5d6d88","0011239001531","MontGras Cabernet Sauvignon Reserva 2007","7.50","EUR",,"Chile - Colchagua Valley. Auszeichnung: GOLDMEDAILLE International Wine Challenge (JG 2003)","Weinkeller / Sonderaktionen / Restposten Wein",,"http://shop.edeka24.de/out/pictures/generated/product/1/185_150_90/Qh6H6oY9hSZivdlGWBzBEd-30.jpg","http://shop.edeka24.de/out/pictures/generated/product/1/380_340_90/Qh6H6oY9hSZivdlGWBzBEd-30.jpg","MontGras","http://www.zanox-affiliate.de/ppc/?20301248C727219293&ULP=[[qf4cba02f1abaf3dc19ff61ffdb73239]]","2",,,"Ab 75 EUR Warenwert liefern wir versandkostenfrei.","3.95"
"2844ca44c0940a2525cc4155fd4c06c7","0011239001539","MontGras Cabernet Sauvignon Reserva 2011","8.49","EUR",,"Chile - Colchagua Valley. Auszeichnung: GOLDMEDAILLE International Wine Challenge (JG 2003)","Weinkeller / Rotwein / Chile Rotwein",,"http://shop.edeka24.de/out/pictures/generated/product/1/185_150_90/Qh6H6oY9hSZivdlGWBzBEd-30.jpg","http://shop.edeka24.de/out/pictures/generated/product/1/380_340_90/Qh6H6oY9hSZivdlGWBzBEd-30.jpg","MontGras","http://www.zanox-affiliate.de/ppc/?20301248C727219293&ULP=[[2EvPZuz8yyhnduiGWBzBEd-1]]","2",,,"Ab 75 EUR Warenwert liefern wir versandkostenfrei.","3.95"
"3d56c49d3ffa329ff3b8d016efa9ad0e","0011239001540","MontGras Cabernet Sauvignon Reserva 2010","7.50","EUR",,"Chile - Colchagua Valley. Auszeichnung: GOLDMEDAILLE International Wine Challenge (JG 2003)","Weinkeller / Sonderaktionen / Restposten Wein",,"http://shop.edeka24.de/out/pictures/generated/product/1/185_150_90/Qh6H6oY9hSZivdlGWBzBEd-30.jpg","http://shop.edeka24.de/out/pictures/generated/product/1/380_340_90/Qh6H6oY9hSZivdlGWBzBEd-30.jpg","MontGras","http://www.zanox-affiliate.de/ppc/?20301248C727219293&ULP=[[0qnab516d3dfe470d08493b95a9dbbf7]]","2",,,"Ab 75 EUR Warenwert liefern wir versandkostenfrei.","3.95"
"d9eb4893f4e4711c343f3b506afcb76f","0011239001638","Osborne Fine Tawny Portwein","9.99","EUR",,"In seinem kräftigen Rot spiegeln sich bernsteinfarbene Lichter. Im Duft dominiert tiefe Frucht mit nussigen Untertönen, die auf der Zunge breiter und cremiger werden.","Weinkeller / Rotwein / Portugal",,"http://shop.edeka24.de/out/pictures/generated/product/1/185_150_90/tMmUIZaQryO9xtEJmn8b78-30.jpg","http://shop.edeka24.de/out/pictures/generated/product/1/380_340_90/tMmUIZaQryO9xtEJmn8b78-30.jpg","Osborne","http://www.zanox-affiliate.de/ppc/?20301248C727219293&ULP=[[rsRZfxURxyhnduiGWBzBEd-1]]","2",,,"Ab 75 EUR Warenwert liefern wir versandkostenfrei.","3.95"
"0042aeda7c4dc40dbf2bff0e852a8527","0011239001805","Robert Mondavi Woodbridge Shiraz Rosé 2010","7.49","EUR",,"Roséwein - USA - Kalifornien. Delikat und herrlich erfrischend auch am Gaumen mit viel saftig aromatischer Frucht, zarten blumigen Noten und pikanter Würze.","Weinkeller / Roséweine",,"http://shop.edeka24.de/out/pictures/generated/product/1/185_150_90/woodbridgeshirazrose_500_z1.jpg","http://shop.edeka24.de/out/pictures/generated/product/1/380_340_90/woodbridgeshirazrose_500_z1.jpg","Robert Mondavi","http://www.zanox-affiliate.de/ppc/?20301248C727219293&ULP=[[4dr4c18d3fda19017.42300614]]","2",,,"Ab 75 EUR Warenwert liefern wir versandkostenfrei.","3.95"
"bdfc91289062bf07a18a717382924cd5","0011239002334","Osborne Tawny Portwein 10 Jahre","31.99","EUR",,"Portugal. Ausgezeichnet mit der Goldmedaille International Wine and Spirits Competition.","Weinkeller / Rotwein / Portugal",,"http://shop.edeka24.de/out/pictures/generated/product/1/185_150_90/GjudLNLnpooAoGfGWBzBEd-30.jpg","http://shop.edeka24.de/out/pictures/generated/product/1/380_340_90/GjudLNLnpooAoGfGWBzBEd-30.jpg","Osborne","http://www.zanox-affiliate.de/ppc/?20301248C727219293&ULP=[[37h2bFVrmooAoGfGWBzBEd-1]]","2",,,"Ab 75 EUR Warenwert liefern wir versandkostenfrei.","3.95"
