"Zupid","sku","ProductName","ProductPrice","CurrencySymbolOfPrice","ValidFromDate","ProductShortDescription","MerchantProductCategory","ZanoxCategoryIds","ImageSmallURL","ImageMediumURL","ProductManufacturerBrand","ZanoxProductLink","DeliveryTime","TermsOfContract","ISBN","ShippingAndHandling","ShippingAndHandlingCost"
"54ea868b01c67387a85381f8a0fd0ef7","0000000174338","Gordons London Dry Gin","13.49","EUR",,"Gin-Liebhaber in aller Welt charakterisieren Gordons als leicht, raffiniert und wunderbar erfrischend.","Spirituosen / Klare Spirituosen / Gin",,"http://shop.edeka24.de/out/pictures/generated/product/1/185_150_90/c22dcf7d873e7a3d52737577ecf1a05b-5000289020602_iq.jpg","http://shop.edeka24.de/out/pictures/generated/product/1/380_340_90/c22dcf7d873e7a3d52737577ecf1a05b-5000289020602_iq.jpg","Gordons","http://www.zanox-affiliate.de/ppc/?20301248C727219293&ULP=[[OqRzwby83BzhKolGWBzBEd-1]]","2",,,"Ab 75 EUR Warenwert liefern wir versandkostenfrei.","3.95"
"6ab7df02b8db8fa751b622439c82952a","0000000174352","Osborne Brandy de Jerez 103","11.49","EUR",,"Osborne 103 reift nach sorgfältiger Herstellung aus feinsten Weintrauben in traditionellen Eichenholzfässern. Dadurch entsteht ein spanischer Brandy von aussergewöhnlich heller Farbe und mildem Geschmack.","Dunkle Spirituosen / Brandy & Weinbrand / Osborne Brandy",,"http://shop.edeka24.de/out/pictures/generated/product/1/185_150_90/e3501017b8cada46dad2c280c0e37778-8410025000459_iq.jpg","http://shop.edeka24.de/out/pictures/generated/product/1/380_340_90/e3501017b8cada46dad2c280c0e37778-8410025000459_iq.jpg","Osborne","http://www.zanox-affiliate.de/ppc/?20301248C727219293&ULP=[[WD9Ffolm3BzhKolGWBzBEd-1]]","2",,,"Ab 75 EUR Warenwert liefern wir versandkostenfrei.","3.95"
"264516f332a3b6c1895fe0c94d5e32f8","0000000174376","Bacardi Rum Superior Carta Blanca","13.79","EUR",,"Das Original: Seit 1862 nach dem Ursprungsrezept hergestellt, verkörpert BACARDI Carta Blanca das pure karibische Lebensgefühl. Und ist heute die meist konsumierte Premium-Spirituose der Welt.","Spirituosen / Dunkle Spirituosen / Rum",,"http://shop.edeka24.de/out/pictures/generated/product/1/185_150_90/55cf0a7575177e65a123eaecf0809b60-5010677014205_iq.jpg","http://shop.edeka24.de/out/pictures/generated/product/1/380_340_90/55cf0a7575177e65a123eaecf0809b60-5010677014205_iq.jpg","Bacardi","http://www.zanox-affiliate.de/ppc/?20301248C727219293&ULP=[[9CYvDO6wCx0t2JmGWBzBEd-1]]","2",,,"Ab 75 EUR Warenwert liefern wir versandkostenfrei.","3.95"
"532989a3d556d73b0c06020e4de60314","0000000174383","Bacardi Rum Black","13.79","EUR",,"Nach der Originalrezeptur aus 1862 hergestellt, ist BACARDI Black in der BACARDI Rum-Familie eine der eleganten Premium-Spirituosen, die heute als Inbegriff karibischer Lebensfreude in den Bars der Welt zu Hause sind.","Spirituosen / Dunkle Spirituosen / Rum",,"http://shop.edeka24.de/out/pictures/generated/product/1/185_150_90/55cf0a7575177e65a123eaecf0809b60-5010677034203_iq.jpg","http://shop.edeka24.de/out/pictures/generated/product/1/380_340_90/55cf0a7575177e65a123eaecf0809b60-5010677034203_iq.jpg","Bacardi","http://www.zanox-affiliate.de/ppc/?20301248C727219293&ULP=[[TiNRGsqwCx0t2JmGWBzBEd-1]]","2",,,"Ab 75 EUR Warenwert liefern wir versandkostenfrei.","3.95"
"7b8b534ea5d38627d933f8dceae803a0","0000000174406","Molinari Sambuca extra","14.99","EUR",,"Italienische Anis-Liqueur-Spezialität.","Spirituosen / Liköre / Anisliköre",,"http://shop.edeka24.de/out/pictures/generated/product/1/185_150_90/molinari_sambuca_300_p1.jpg","http://shop.edeka24.de/out/pictures/generated/product/1/380_340_90/molinari_sambuca_300_p1.jpg","Molinari","http://www.zanox-affiliate.de/ppc/?20301248C727219293&ULP=[[tPjgdzP83BzhKolGWBzBEd-1]]","2",,,"Ab 75 EUR Warenwert liefern wir versandkostenfrei.","3.95"
"aa30358511a7fe99a945d2bbf2a5f65b","0000000174444","Ouzo 12","11.49","EUR",,"Ein griechischer Aperitif, genannt der Geist Griechenlands. Er wird aus einer einzigartigen Mischung hergestellt.","Spirituosen / Liköre / Anisliköre",,"http://shop.edeka24.de/out/pictures/generated/product/1/185_150_90/-5201003110702_iq.jpg","http://shop.edeka24.de/out/pictures/generated/product/1/380_340_90/-5201003110702_iq.jpg","","http://www.zanox-affiliate.de/ppc/?20301248C727219293&ULP=[[xkVchf693BzhKolGWBzBEd-1]]","2",,,"Ab 75 EUR Warenwert liefern wir versandkostenfrei.","3.95"
"49d620d86bfc5a14915b297b02f6ec4c","0000000174499","Tio Pepe Sherry Palomino Fino Extra Dry","9.49","EUR",,"Stilvoll als Aperitif, saftig zu frischen Meeresfrüchten und besonders schick zur asiatischen Küche! Tío Pepe sollte stets gut gekühlt serviert und auch im Kühlschrank aufbewahrt werden.","Weinkeller / Portwein & Sherry",,"http://shop.edeka24.de/out/pictures/generated/product/1/185_150_90/tiopepe_500_z1.jpg","http://shop.edeka24.de/out/pictures/generated/product/1/380_340_90/tiopepe_500_z1.jpg","Tio Pepe","http://www.zanox-affiliate.de/ppc/?20301248C727219293&ULP=[[c4rFgfE93BzhKolGWBzBEd-1]]","2",,,"Ab 75 EUR Warenwert liefern wir versandkostenfrei.","3.95"
"ccffe21aad68d217736bd89605c0f3ca","0000000174536","Pommery Champagner Brut Royal","33.99","EUR",,"Das Herzstück des Hauses Pommery! Ein Champagner für jede Gelegenheit. Er glänzt durch sein elegantes, aber diskretes Aroma.","Champagner / Sekt / Champagner / Pommery Champagner",,"http://shop.edeka24.de/out/pictures/generated/product/1/185_150_90/LBE2PXs1KJFAoGfGWBzBEd-30.jpg","http://shop.edeka24.de/out/pictures/generated/product/1/380_340_90/LBE2PXs1KJFAoGfGWBzBEd-30.jpg","Pommery","http://www.zanox-affiliate.de/ppc/?20301248C727219293&ULP=[[vjU7QBV93BzhKolGWBzBEd-1]]","2",,,"Ab 75 EUR Warenwert liefern wir versandkostenfrei.","3.95"
"f23677c2c30626f2f71cb61c4ce20d2e","0000000175607","Jägermeister Kräuterlikör","11.99","EUR",,"Das Original aus Wolfenbüttel - die größte Kräuterspirituose der Welt - Jägermeister.","Spirituosen / Liköre / Kräuterliköre",,"http://shop.edeka24.de/out/pictures/generated/product/1/185_150_90/jgermeister-kruterlikr-07.jpg","http://shop.edeka24.de/out/pictures/generated/product/1/380_340_90/jgermeister-kruterlikr-07.jpg","Jägermeister","http://www.zanox-affiliate.de/ppc/?20301248C727219293&ULP=[[tFJVyO0ECx0t2JmGWBzBEd-1]]","2",,,"Ab 75 EUR Warenwert liefern wir versandkostenfrei.","3.95"
"13a032a7e15618e37b061eeb85c9046c","0000000175614","Jägermeister Kräuterlikör 0,35 Liter","6.49","EUR",,"Das Original aus Wolfenbüttel - die größte Kräuterspirituose der Welt - Jägermeister.","",,"http://shop.edeka24.de/out/pictures/generated/product/1/185_150_90/jgermeister-kruterlikr-035.jpg","http://shop.edeka24.de/out/pictures/generated/product/1/380_340_90/jgermeister-kruterlikr-035.jpg","Jägermeister","http://www.zanox-affiliate.de/ppc/?20301248C727219293&ULP=[[c284d997db986c523.30882137]]","2",,,"Ab 75 EUR Warenwert liefern wir versandkostenfrei.","3.95"
"854e4188df15d0aa176bbd38e022974a","0000000175836","Underberg Kräuter-Bitter 4er","3.49","EUR",,"Underberg wirkt durch die Kraft erlesener und aromatischer Kräuter aus 43 Länder der Welt.","Spirituosen / Klare Spirituosen / Bitter",,"http://shop.edeka24.de/out/pictures/generated/product/1/185_150_90/4er-pack_2011_3d.png","http://shop.edeka24.de/out/pictures/generated/product/1/380_340_90/4er-pack_2011_3d.png","Underberg","http://www.zanox-affiliate.de/ppc/?20301248C727219293&ULP=[[KWov9tPFCx0t2JmGWBzBEd-1]]","2",,,"Ab 75 EUR Warenwert liefern wir versandkostenfrei.","3.95"
"6099ceba72234e022b28ec26dc831b01","0000000175867","Underberg Kräuter-Bitter 12er","9.49","EUR",,"Underberg wirkt durch die Kraft erlesener und aromatischer Kräuter aus 43 Länder der Welt.","Spirituosen / Klare Spirituosen / Bitter",,"http://shop.edeka24.de/out/pictures/generated/product/1/185_150_90/12er-pack_2011_3d.png","http://shop.edeka24.de/out/pictures/generated/product/1/380_340_90/12er-pack_2011_3d.png","Underberg","http://www.zanox-affiliate.de/ppc/?20301248C727219293&ULP=[[qH9qO76GCx0t2JmGWBzBEd-1]]","2",,,"Ab 75 EUR Warenwert liefern wir versandkostenfrei.","3.95"
"124493d6e64d2d2a09a3019498fd0603","0000000175904","Xuxu Erdbeerlimes","6.49","EUR",,"Wodka Erdbeer-Drink mit über 66% Frucht.","Spirituosen / Liköre / Szene Drinks",,"http://shop.edeka24.de/out/pictures/generated/product/1/185_150_90/xuxu_05l_2012-750.jpg","http://shop.edeka24.de/out/pictures/generated/product/1/380_340_90/xuxu_05l_2012-750.jpg","Xuxu","http://www.zanox-affiliate.de/ppc/?20301248C727219293&ULP=[[z1zYNFCGCx0t2JmGWBzBEd-1]]","2",,,"Ab 75 EUR Warenwert liefern wir versandkostenfrei.","3.95"
"2e0d2e956dd5a6f1c30b709d8b39dab1","0000000175973","Pitu Premium Cachaca","11.49","EUR",,"brasilianische Zuckerrohr Spirituose.","Spirituosen / Dunkle Spirituosen / Rum",,"http://shop.edeka24.de/out/pictures/generated/product/1/185_150_90/418fb1120b0c7d90b074f055e111cfee-4000269101292_iq.jpg","http://shop.edeka24.de/out/pictures/generated/product/1/380_340_90/418fb1120b0c7d90b074f055e111cfee-4000269101292_iq.jpg","Pitu","http://www.zanox-affiliate.de/ppc/?20301248C727219293&ULP=[[Nrh8aPsHCx0t2JmGWBzBEd-1]]","2",,,"Ab 75 EUR Warenwert liefern wir versandkostenfrei.","3.95"
"cbf815f941cef8e24f2d896183414759","0000000176136","Weis Offenburger Teufel Kräuterlikör","9.99","EUR",,"Hochprozentiger Kräuterlikör. Auch gut zum Anzünden und Flambieren.","Spirituosen / Liköre / Kräuterliköre",,"http://shop.edeka24.de/out/pictures/generated/product/1/185_150_90/offenburger_teufel.jpg","http://shop.edeka24.de/out/pictures/generated/product/1/380_340_90/offenburger_teufel.jpg","Weis","http://www.zanox-affiliate.de/ppc/?20301248C727219293&ULP=[[c284d997dc9d0f3d4.90261859]]","2",,,"Ab 75 EUR Warenwert liefern wir versandkostenfrei.","3.95"
"587152a0c8cdde3bc9ac482f0debd938","0000000176280","Southern Comfort Premium-Likör","17.29","EUR",,"die einzigartige Premium-Mix-Spirituose aus New Orleans.","Spirituosen / Liköre / Kräuterliköre",,"http://shop.edeka24.de/out/pictures/generated/product/1/185_150_90/southerncomfort_500_z1.jpg","http://shop.edeka24.de/out/pictures/generated/product/1/380_340_90/southerncomfort_500_z1.jpg","Southern Comfort","http://www.zanox-affiliate.de/ppc/?20301248C727219293&ULP=[[bVfN3eQxCx0t2JmGWBzBEd-1]]","2",,,"Ab 75 EUR Warenwert liefern wir versandkostenfrei.","3.95"
"21e36793bac2eacde54d17a55c8b96da","0000000176402","Dujardin Weinbrand Imperial VSOP","10.99","EUR",,"Alter Weinbrand","Spirituosen / Dunkle Spirituosen / Brandy & Weinbrand",,"http://shop.edeka24.de/out/pictures/generated/product/1/185_150_90/-4001731200796_iq.jpg","http://shop.edeka24.de/out/pictures/generated/product/1/380_340_90/-4001731200796_iq.jpg","Dujardin","http://www.zanox-affiliate.de/ppc/?20301248C727219293&ULP=[[c284d997e1b1228e5.76445436]]","2",,,"Ab 75 EUR Warenwert liefern wir versandkostenfrei.","3.95"
"af75f32d18bb3d666b377f3507a55902","0000000177498","Schladerer Himbeergeist","17.49","EUR",,"Der Geistige. Frische, unvergorene Waldhimbeeren aus den Karpaten verleihen unserer Spezialität das unvergleichliche Aroma.","Spirituosen / Klare Spirituosen / Edelbrand",,"http://shop.edeka24.de/out/pictures/generated/product/1/185_150_90/himbeergeist_500_z1.jpg","http://shop.edeka24.de/out/pictures/generated/product/1/380_340_90/himbeergeist_500_z1.jpg","Schladerer","http://www.zanox-affiliate.de/ppc/?20301248C727219293&ULP=[[cmqBFE4QCx0t2JmGWBzBEd-1]]","2",,,"Ab 75 EUR Warenwert liefern wir versandkostenfrei.","3.95"
"156e8050aa121c647f9ae147b6a8fbe0","0000000177535","Schladerer Schwarzwälder Kirschwasserbrand","19.79","EUR",,"Kirschwasserbrand. Mind. 2 Jahre gereift.","Spirituosen / Klare Spirituosen / Edelbrand",,"http://shop.edeka24.de/out/pictures/generated/product/1/185_150_90/732e7ca80214250ec337184cba4292e9-4047300002019_iq.jpg","http://shop.edeka24.de/out/pictures/generated/product/1/380_340_90/732e7ca80214250ec337184cba4292e9-4047300002019_iq.jpg","Schladerer","http://www.zanox-affiliate.de/ppc/?20301248C727219293&ULP=[[hQOvdrAQCx0t2JmGWBzBEd-1]]","2",,,"Ab 75 EUR Warenwert liefern wir versandkostenfrei.","3.95"
"eba2c4b672da6acc22c79ef8fa49244d","0000000177542","Schladerer Obstwasserbrand","11.99","EUR",,"Obstwasserbrand. Äpfel und Birnen aus erstklassigen Anbaugebieten, unbeschädigte Früchte bester Qualität.","Spirituosen / Klare Spirituosen / Edelbrand",,"http://shop.edeka24.de/out/pictures/generated/product/1/185_150_90/732e7ca80214250ec337184cba4292e9-4047300013015_iq.jpg","http://shop.edeka24.de/out/pictures/generated/product/1/380_340_90/732e7ca80214250ec337184cba4292e9-4047300013015_iq.jpg","Schladerer","http://www.zanox-affiliate.de/ppc/?20301248C727219293&ULP=[[hlc4ca353a50442f9.82523183]]","2",,,"Ab 75 EUR Warenwert liefern wir versandkostenfrei.","3.95"
"40bc560431ab78976493ab3bacfaa269","0000000177580","Schladerer Williamsbirnebrand","19.79","EUR",,"Williamsbirnebrand. Durch Auswahl vollreifer, aromatischer Birnen der Sorte Williams-Christ aus klimatisch begünstigten Gebieten","Spirituosen / Klare Spirituosen / Edelbrand",,"http://shop.edeka24.de/out/pictures/generated/product/1/185_150_90/732e7ca80214250ec337184cba4292e9-4047300003016_iq.jpg","http://shop.edeka24.de/out/pictures/generated/product/1/380_340_90/732e7ca80214250ec337184cba4292e9-4047300003016_iq.jpg","Schladerer","http://www.zanox-affiliate.de/ppc/?20301248C727219293&ULP=[[mnavsW6RCx0t2JmGWBzBEd-1]]","2",,,"Ab 75 EUR Warenwert liefern wir versandkostenfrei.","3.95"
"616eed1f5061c9800d744b79e91f5814","0000000177962","Amarula Fruit Cream-Liqueur","12.49","EUR",,"Amarula Cream fängt das charakteristische Aroma der Frucht des legendären Marula-Baums in einem vollmundigen, sanften Sahnelikör ein. Unverwechselbar, aufregend und raffiniert.","Spirituosen / Liköre / Cream",,"http://shop.edeka24.de/out/pictures/generated/product/1/185_150_90/amarula_300.jpg","http://shop.edeka24.de/out/pictures/generated/product/1/380_340_90/amarula_300.jpg","Amarula","http://www.zanox-affiliate.de/ppc/?20301248C727219293&ULP=[[kvrBZaGZ1BzhKolGWBzBEd-1]]","2",,,"Ab 75 EUR Warenwert liefern wir versandkostenfrei.","3.95"
"3fc044f6b726f9fb89c7362af7fa0d49","0000000177993","Bushmills 10 Jahre Single Malt Irish Whiskey","25.79","EUR",,"Irland. Der älteste irische Single Malt im deutschen Markt aus der ältesten Whisky Destillerie der Welt.","Whisky / Alter / 0 - 10 Jahre",,"http://shop.edeka24.de/out/pictures/generated/product/1/185_150_90/bushmillswhisky10jahre5_z1.jpg","http://shop.edeka24.de/out/pictures/generated/product/1/380_340_90/bushmillswhisky10jahre5_z1.jpg","Bushmills","http://www.zanox-affiliate.de/ppc/?20301248C727219293&ULP=[[2PoQ7Pv45BzhKolGWBzBEd-1]]","2",,,"Ab 75 EUR Warenwert liefern wir versandkostenfrei.","3.95"
"87246c8e49205468ce91893d74e40a14","0000000179777","Hardenberg Persico mit Sauerkirsch","6.99","EUR",,"","Spirituosen / Liköre / Szene Drinks",,"http://shop.edeka24.de/out/pictures/generated/product/1/185_150_90/persicosauerkirsch320.jpg","http://shop.edeka24.de/out/pictures/generated/product/1/380_340_90/persicosauerkirsch320.jpg","Hardenberg","http://www.zanox-affiliate.de/ppc/?20301248C727219293&ULP=[[pr582245436d8a22c6bf3c85599c3524]]","2",,,"Ab 75 EUR Warenwert liefern wir versandkostenfrei.","3.95"
"e1afdc2705c3c1c20c837ff194da0c9d","0000000180579","Dole Du Valais Rotwein 2011","8.99","EUR",,"Rotwein - Schweiz - Wallis.","Weinkeller / Rotwein / Schweiz Rotwein",,"http://shop.edeka24.de/out/pictures/generated/product/1/185_150_90/-7610268147039_iq.jpg","http://shop.edeka24.de/out/pictures/generated/product/1/380_340_90/-7610268147039_iq.jpg","Dole Du Valais","http://www.zanox-affiliate.de/ppc/?20301248C727219293&ULP=[[c284d997dfe7d7146.68970259]]","2",,,"Ab 75 EUR Warenwert liefern wir versandkostenfrei.","3.95"
"43e54e6abc3aff9f2ac194211d80a68f","0000000180623","Fendant du Valais Gutedel JG 2011","8.49","EUR",,"Weißwein - Schweiz - Wallis.","Weinkeller / Weißwein / Schweiz Weißwein",,"http://shop.edeka24.de/out/pictures/generated/product/1/185_150_90/-7610268146919.jpg","http://shop.edeka24.de/out/pictures/generated/product/1/380_340_90/-7610268146919.jpg","Fendant du Valais","http://www.zanox-affiliate.de/ppc/?20301248C727219293&ULP=[[c284d997dfe801572.18156220]]","2",,,"Ab 75 EUR Warenwert liefern wir versandkostenfrei.","3.95"
"f82c3304457f9ad358250d33ef3c2eaf","0000000190088","jura Entkalkungstabletten","10.49","EUR",,"","Kaffee / Feinkost / Zubehör / jura",,"http://shop.edeka24.de/out/pictures/generated/product/1/185_150_90/vEcY907usT7jvdlGWBzBEd-30.jpg","http://shop.edeka24.de/out/pictures/generated/product/1/380_340_90/vEcY907usT7jvdlGWBzBEd-30.jpg","jura","http://www.zanox-affiliate.de/ppc/?20301248C727219293&ULP=[[qZQfS6O0tT7jvdlGWBzBEd-1]]","2",,,"Ab 75 EUR Warenwert liefern wir versandkostenfrei.","3.95"
"c14e9fec73fdd4efd86fa8c15d859644","0000000190286","jura Reinigungstabletten","7.29","EUR",,"... if you love coffee","Kaffee / Feinkost / Zubehör / jura",,"http://shop.edeka24.de/out/pictures/generated/product/1/185_150_90/34vYa4IgSS7jvdlGWBzBEd-30.jpg","http://shop.edeka24.de/out/pictures/generated/product/1/380_340_90/34vYa4IgSS7jvdlGWBzBEd-30.jpg","jura","http://www.zanox-affiliate.de/ppc/?20301248C727219293&ULP=[[1CSZgecvRS7jvdlGWBzBEd-1]]","2",,,"Ab 75 EUR Warenwert liefern wir versandkostenfrei.","3.95"
"bc5a830878629d786b428497ad019c11","0000000199634","Pure Cofain 699","1.79","EUR",,"Achtung! Stark koffeinhaltig. 699 mg Koffein pro Liter.","+NEU+",,"http://shop.edeka24.de/out/pictures/generated/product/1/185_150_90/pure-cofain-drink-300.jpg","http://shop.edeka24.de/out/pictures/generated/product/1/380_340_90/pure-cofain-drink-300.jpg","","http://www.zanox-affiliate.de/ppc/?20301248C727219293&ULP=[[ekt11545c511eb96866586a26b6b87a5]]","2",,,"Ab 75 EUR Warenwert liefern wir versandkostenfrei.","3.95"
"97bd4da21c39aa1a63b6b00bb066f104","0000000208644","Ricardo Sanz Sombras DO Ribera del Duero 2007","7.99","EUR",,"Rotwein - Spanien - Rueda-Kastilien. Aus der Selection Alexander von Essen.","Weinkeller / Sonderaktionen / Alexander von Essen",,"http://shop.edeka24.de/out/pictures/generated/product/1/185_150_90/sombrosdo_300_p1.jpg","http://shop.edeka24.de/out/pictures/generated/product/1/380_340_90/sombrosdo_300_p1.jpg","Ricardo Sanz","http://www.zanox-affiliate.de/ppc/?20301248C727219293&ULP=[[gpf4eba44c9f41746.52644303]]","2",,,"Ab 75 EUR Warenwert liefern wir versandkostenfrei.","3.95"
"36248d2a52f78b76f6c1847195c38237","0000000212988","theo der essigbrauer Deutscher Balsamico Essig rosé","4.29","EUR",,"naturtrüb - aus badischen Weinen.","",,"http://shop.edeka24.de/out/pictures/generated/product/1/185_150_90/theo-essig-balsamico-rose.jpg","http://shop.edeka24.de/out/pictures/generated/product/1/380_340_90/theo-essig-balsamico-rose.jpg","theo der essigbrauer","http://www.zanox-affiliate.de/ppc/?20301248C727219293&ULP=[[i024d54eae7930b20.83219063]]","2",,,"Ab 75 EUR Warenwert liefern wir versandkostenfrei.","3.95"
"f50f2d0ec913063c50cdc370481a0882","0000000213332","Bodegas Santa Celina Malbec Rotwein JG 2008","6.99","EUR",,"Rotwein - Argentinien - Mendoza. Aus der Selection Alexander von Essen.","Weinkeller / Sonderaktionen / Alexander von Essen",,"http://shop.edeka24.de/out/pictures/generated/product/1/185_150_90/malbecave_500_z1.jpg","http://shop.edeka24.de/out/pictures/generated/product/1/380_340_90/malbecave_500_z1.jpg","Bodegas Santa Celina","http://www.zanox-affiliate.de/ppc/?20301248C727219293&ULP=[[1vp4ab34a71579030.59494338]]","2",,,"Ab 75 EUR Warenwert liefern wir versandkostenfrei.","3.95"
"92df407752ade1e98ba8d44a7eea60dd","0000000213677","Ricardo Sanz Tinta de Toro DO Rotwein JG 2008","7.99","EUR",,"Rotwein - Spanien - Rueda-Kastilien. Aus der Selection Alexander von Essen.","Weinkeller / Sonderaktionen / Alexander von Essen",,"http://shop.edeka24.de/out/pictures/generated/product/1/185_150_90/tintadetorodo_300_p1.jpg","http://shop.edeka24.de/out/pictures/generated/product/1/380_340_90/tintadetorodo_300_p1.jpg","Ricardo Sanz","http://www.zanox-affiliate.de/ppc/?20301248C727219293&ULP=[[gpf4eba4bbfadc3f2.74133660]]","2",,,"Ab 75 EUR Warenwert liefern wir versandkostenfrei.","3.95"
"e59316997b83c791c0d4765e504135c9","0000000214205","Nescafé Dolce Gusto Lungo Decaffeinato Kaffeekapseln","4.99","EUR",,"Mit dem NESCAFE Dolce Gusto System genießen Sie Coffee-Shop-Qualität zu Hause.","Kaffee / Feinkost / Kaffeepads / Nescafe Dolce Gusto",,"http://shop.edeka24.de/out/pictures/generated/product/1/185_150_90/7613031794331.png","http://shop.edeka24.de/out/pictures/generated/product/1/380_340_90/7613031794331.png","Nescafé Dolce Gusto","http://www.zanox-affiliate.de/ppc/?20301248C727219293&ULP=[[pij4b04059c085f05.95552061]]","2",,,"Ab 75 EUR Warenwert liefern wir versandkostenfrei.","3.95"
"59ec614667564174f7b6327324555243","0000000224295","Juan Gil El Pino Monastrell Rotwein JG 2011","4.99","EUR",,"Rotwein - Spanien - Jumilla. Aus der Selection Alexander von Essen.","Weinkeller / Sonderaktionen / Alexander von Essen",,"http://shop.edeka24.de/out/pictures/generated/product/1/185_150_90/elpinomonastrell_300_p1.jpg","http://shop.edeka24.de/out/pictures/generated/product/1/380_340_90/elpinomonastrell_300_p1.jpg","Juan Gil","http://www.zanox-affiliate.de/ppc/?20301248C727219293&ULP=[[2ob4e92bbc6812280.91565671]]","2",,,"Ab 75 EUR Warenwert liefern wir versandkostenfrei.","3.95"
"acda27f439cdc15e8d865be354d8b4a5","0000000228112","Castillo de la Villa El Olivo Tinta de Toro JG 2011","5.49","EUR",,"Rotwein - Spanien. Aus der Selection Alexander von Essen.","Weinkeller / Sonderaktionen / Alexander von Essen",,"http://shop.edeka24.de/out/pictures/generated/product/1/185_150_90/tintadetoroelolivo_300_p1.jpg","http://shop.edeka24.de/out/pictures/generated/product/1/380_340_90/tintadetoroelolivo_300_p1.jpg","Castillo de la Villa","http://www.zanox-affiliate.de/ppc/?20301248C727219293&ULP=[[gpf4eba2f9250bb93.65231667]]","2",,,"Ab 75 EUR Warenwert liefern wir versandkostenfrei.","3.95"
"5f0e85c1277b507de101ee9ab706d919","0000000237956","Veuve Amiot Cremant de Loire Brut","7.49","EUR",,"","Champagner / Sekt / Sekt / Crémant Sekt",,"http://shop.edeka24.de/out/pictures/generated/product/1/185_150_90/3438931005134.png","http://shop.edeka24.de/out/pictures/generated/product/1/380_340_90/3438931005134.png","Veuve Amiot","http://www.zanox-affiliate.de/ppc/?20301248C727219293&ULP=[[0864c0aea6302f4b9.75024743]]","2",,,"Ab 75 EUR Warenwert liefern wir versandkostenfrei.","3.95"
"902bbb49303cf830cd1908b8f1ab19fe","0000000238874","Ricossa Barbera D´Asti DOC Rotwein JG 2010","4.29","EUR",,"Rotwein - Italien","Weinkeller / Rotwein / Italien Rotwein",,"http://shop.edeka24.de/out/pictures/generated/product/1/185_150_90/8032610313531_sw.jpg","http://shop.edeka24.de/out/pictures/generated/product/1/380_340_90/8032610313531_sw.jpg","Ricossa","http://www.zanox-affiliate.de/ppc/?20301248C727219293&ULP=[[lk7bd7ecfe01740ea3c823746e1036a9]]","2",,,"Ab 75 EUR Warenwert liefern wir versandkostenfrei.","3.95"
"95a7b8b6c4f59eadb5adfbb08cb55897","0000000244008","VITIS Vital Traubenkern Spaghetti","2.29","EUR",,"Herzhaft kerniger Akzent.","Kaffee / Feinkost / Feinkost / VITIS Vital",,"http://shop.edeka24.de/out/pictures/generated/product/1/185_150_90/vitisvitalspaghettishop.jpg","http://shop.edeka24.de/out/pictures/generated/product/1/380_340_90/vitisvitalspaghettishop.jpg","VITIS Vital","http://www.zanox-affiliate.de/ppc/?20301248C727219293&ULP=[[oqk0ea7f205384ae15fcde7cd5062d79]]","2",,,"Ab 75 EUR Warenwert liefern wir versandkostenfrei.","3.95"
"5ded932011e6cd693395b9d5dba49a99","0000000251174","OWK Ihringer Weissherbst QbA 1 ltr lieblich 2011","4.29","EUR",,"Weißwein - Deutschland - Baden - Ortenauer Weinkellerei. Ein feiner, fruchtiger Roséwein, aus der Spätburgundertraube gewonnen.","Deutschland / Weinkeller / Roséweine",,"http://shop.edeka24.de/out/pictures/generated/product/1/185_150_90/c28484f7aa3a0f87ffb27f9c18b521d0-4007474861577_iq.jpg","http://shop.edeka24.de/out/pictures/generated/product/1/380_340_90/c28484f7aa3a0f87ffb27f9c18b521d0-4007474861577_iq.jpg","OWK","http://www.zanox-affiliate.de/ppc/?20301248C727219293&ULP=[[i2h4cc1577e422a65.71412584]]","2",,,"Ab 75 EUR Warenwert liefern wir versandkostenfrei.","3.95"
"3e5c8cf1b203a2ff18a574d567a0b176","0000000251952","Montalto Nero d Avola IGT Rotwein","4.99","EUR",,"Rotwein - Italien - Sizilien, SILBER Premium Select Wine Challange 2006.","Weinkeller / Rotwein / Italien Rotwein",,"http://shop.edeka24.de/out/pictures/generated/product/1/185_150_90/8fafc70dc55237ac9c4601dad4786316-8030423000020.jpg","http://shop.edeka24.de/out/pictures/generated/product/1/380_340_90/8fafc70dc55237ac9c4601dad4786316-8030423000020.jpg","Montalto","http://www.zanox-affiliate.de/ppc/?20301248C727219293&ULP=[[FullUuzs2BzhKolGWBzBEd-1]]","2",,,"Ab 75 EUR Warenwert liefern wir versandkostenfrei.","3.95"
"cbc3b0838dce2d5f1fc72ef0568cb6e7","0000000252108","Rasgon de Maria Tempranillo Rotwein halbtr. 2011","4.79","EUR",,"Rotwein - Spanien - La Mancha.","Weinkeller / Rotwein / Spanien Rotwein",,"http://shop.edeka24.de/out/pictures/generated/product/1/185_150_90/rasgondemariatempranillo075l.png","http://shop.edeka24.de/out/pictures/generated/product/1/380_340_90/rasgondemariatempranillo075l.png","Rasgon de Maria","http://www.zanox-affiliate.de/ppc/?20301248C727219293&ULP=[[LpoFhIr2hDXRlUhGWBzBEd-1]]","2",,,"Ab 75 EUR Warenwert liefern wir versandkostenfrei.","3.95"
